{
  "schemaVersion": 1,
  "id": "resolution-demo",
  "status": "resolved",
  "inputKind": "video",
  "sourceID": "source-youtube-demo",
  "channelID": "UCabcdefghijklmnopqrstuv",
  "canonicalFeedURL": "https://www.youtube.com/feeds/videos.xml?channel_id=UCabcdefghijklmnopqrstuv",
  "videoID": "AbCdEfGhI01",
  "timestampMs": 83000,
  "capabilities": {
    "nativeAudio": false,
    "visibleVideo": true,
    "analyzeText": false,
    "analyzeAudio": false,
    "timedPlayback": false,
    "reasonCodes": [
      "noAuthorizedContentSource"
    ]
  },
  "offeredActions": [
    "singleEpisode",
    "subscribe",
    "backfill"
  ]
}
